谁,shei2,who; also pronounced shui2
伸,shen1,to stretch; to extend
深,shen1,"close; deep; late; profound; dark (of color, water etc)"
深刻,shen1 ke4,profound; deep; deep-going
身材,shen1 cai2,stature; build (height and weight); figure
身份,shen1 fen4,identity; status; capacity; dignity; position; rank
身体,shen1 ti3,(human) body; health; CL:個|个[ge4]
申请,shen1 qing3,to apply for sth; application (form etc); CL:份[fen4]
神话,shen2 hua4,fairy tale; mythology; myth
神经,shen2 jing1,nerve
神秘,shen2 mi4,mysterious; mystery
什么,shen2 me5,what?; who?; something; anything
甚至,shen4 zhi4,even; so much so that
升,sheng1,to raise; to hoist; to promote; metric liter (also written 公升); measure for dry grain equal to one-tenth dou 斗
生病,sheng1 bing4,to fall ill; to sicken
生产,sheng1 chan3,childbirth; parturition; to produce; manufacture
生动,sheng1 dong4,vivid; lively
生活,sheng1 huo2,life; activity; to live; livelihood
生命,sheng1 ming4,life; living; biological; CL:個|个[ge4]
生气,sheng1 qi4,angry; mad; offended; animated; to get angry; to be enraged; to take offense; animation
生日,sheng1 ri4,birthday; CL:個|个[ge4]
声调,sheng1 diao4,tone; note; a tone (on a Chinese syllable); CL:個|个[ge4]
声音,sheng1 yin1,voice; sound; CL:個|个[ge4]
绳子,sheng2 zi5,cord; string; rope; CL:條|条[tiao2]
省,sheng3,to save; to economize; to do without; to omit; to leave out; province; CL:個|个[ge4]
省略,sheng3 lve4,to leave out; an omission
剩,sheng4,to remain; to be left; to have as remainder
胜利,sheng4 li4,victory; CL:個|个[ge4]
诗,shi1,poem; CL: 首[shou3]; poetry; verse; abbr. for Book of Songs 詩經|诗经[shi1 jing1]
失败,shi1 bai4,to be defeated; to lose; to fail (e.g. experiments); failure; defeat; CL:次[ci4]
失眠,shi1 mian2,(suffer from) insomnia
失去,shi1 qu4,to lose
失望,shi1 wang4,disappointed; to lose hope; to despair
失业,shi1 ye4,unemployment
师傅,shi1 fu5,"master; qualified worker; respectful form of address for older men; CL:個|个[ge4],位[wei4],名[ming2]"
湿润,shi1 run4,moist
狮子,shi1 zi5,"lion; CL:隻|只[zhi1],頭|头[tou2]; Leo (star sign)"
十,shi2,ten; 10
十分,shi2 fen1,to divide into ten equal parts; very; hundred percent; completely; extremely; utterly; absolutely
时代,shi2 dai4,age; era; epoch; period; CL:個|个[ge4]
时候,shi2 hou5,time; length of time; moment; period
时间,shi2 jian1,time; period; CL:段[duan4]
时刻,shi2 ke4,moment; CL:個|个[ge4]; constantly; always
时髦,shi2 mao2,in vogue; fashionable
时期,shi2 qi1,a period in time or history; period; time (interval); phase; CL:個|个[ge4]
时尚,shi2 shang4,fashion
实话,shi2 hua4,truth
实际,shi2 ji4,actual; reality; practice
实践,shi2 jian4,to practice; to put into practice; to fulfill
实习,shi2 xi2,to practice; field work
实现,shi2 xian4,to achieve; to implement; to realize; to bring about
实行,shi2 xing2,to implement; to carry out; to put into practice
实验,shi2 yan4,"to experiment; experiments; CL:個|个[ge4],次[ci4]"
实用,shi2 yong4,practical; functional; pragmatic; applied (science)
实在,shi2 zai4,in reality; honestly; really; verily; concrete
食品,shi2 pin3,foodstuff; food; provisions; CL:種|种[zhong3]
食物,shi2 wu4,food; CL:種|种[zhong3]
石头,shi2 tou5,stone; CL:塊|块[kuai4]
使,shi3,to make; to cause; to enable; to use; to employ; to send; to instruct sb to do sth; envoy; messenger
使劲儿,shi3 jin4 r5,to exert all one's strength
使用,shi3 yong4,to use; to employ; to apply; to make use of
始终,shi3 zhong1,from beginning to end; all along
是,shi4,is; are; am; yes; to be
是否,shi4 fou3,whether (or not); if; is or isn't
试,shi4,to test; to try; experiment; examination; test
试卷,shi4 juan4,"examination paper; test paper; CL:份[fen4],張|张[zhang1]"
士兵,shi4 bing1,soldier; CL:個|个[ge4]
市场,shi4 chang3,market place; market (also in abstract); abbr. for 超級市場|超级市场 supermarket; CL:個|个[ge4]
似的,shi4 de5 ,seems as if; rather like;
适合,shi4 he2,to fit; to suit
适应,shi4 ying4,to suit; to fit; to be suitable; to adapt; to get used to sth
世纪,shi4 ji4,century; CL:個|个[ge4]
世界,shi4 jie4,world; CL:個|个[ge4]
事情,shi4 qing5,"affair; matter; thing; business; CL:件[jian4],樁|桩[zhuang1]
"
事实,shi4 shi2,a fact; the fact that; CL:個|个[ge4]
事物,shi4 wu4,thing; object; CL:個|个[ge4]
事先,shi4 xian1,in advance; before the event; beforehand; prior
收,shou1,to receive; to accept; to collect; in care of (used on address line after name)
收获,shou1 huo4,benefit; reward
收据,shou1 ju4,receipt; CL:張|张[zhang1]
收入,shou1 ru4,"to take in; income; revenue; CL:筆|笔[bi3],個|个[ge4]"
收拾,shou1 shi5,to put in order; to tidy up; to pack; to repair; to punish (colloquial); to manage
手表,shou3 biao3,"wrist watch; CL:塊|块[kuai4],隻|只[zhi1],個|个[ge4]"
手工,shou3 gong1,handwork; manual
手机,shou3 ji1,cell phone; cellular phone; mobile phone; CL:部[bu4]
手术,shou3 shu4,surgical operation; operation; surgery; CL:個|个[ge4]
手套,shou3 tao4,"glove; mitten; CL:雙|双[shuang1],隻|只[zhi1]"
手续,shou3 xu4,"formalities; procedures; CL:道[dao4],個|个[ge4]"
手指,shou3 zhi3,"finger; CL:個|个[ge4],隻|只[zhi1]"
首都,shou3 du1,capital (city); CL:個|个[ge4]
首先,shou3 xian1,first (of all); in the first place
瘦,shou4,tight; thin; lean
受不了,shou4 bu4 liao3,unbearable; unable to endure; can't stand
受到,shou4 dao4,to receive; to suffer; obtained; given
受伤,shou4 shang1,to sustain injuries; wounded (in an accident etc); harmed
售货员,shou4 huo4 yuan2,salesperson; CL:個|个[ge4]
寿命,shou4 ming4,life span; life expectancy
书,shu1,"book; letter; CL:本[ben3],冊|册[ce4],部[bu4]; see also 書經|书经 Book of History"
书架,shu1 jia4,bookshelf; CL:個|个[ge4]
输,shu1,to lose; to transport; to donate; to enter (a password)
输入,shu1 ru4,to import; to input
蔬菜,shu1 cai4,vegetables; produce; CL:種|种[zhong3]
舒服,shu1 fu5,comfortable; feeling well
舒适,shu1 shi4,cozy; snug
叔叔,shu1 shu5,father's younger brother; uncle; Taiwan pr. shu2 shu5; CL:個|个[ge4]
梳子,shu1 zi5,comb; CL:把[ba3]
熟练,shu2 lian4,practiced; proficient; skilled; skillful
熟悉,shu2 xi1,to be familiar with; to know well
鼠标,shu3 biao1,mouse (computing)
属于,shu3 yu2,classified as; to belong to; to be part of
树,shu4,tree; CL:棵[ke1]
数据,shu4 ju4,data; numbers; digital; also written 數據|数据
数量,shu4 liang4,amount; quantity; CL:個|个[ge4]
数码,shu4 ma3,number; numerals; figures; digital; amount; numerical code
数学,shu4 xue2,mathematics; mathematical
数字,shu4 zi4,numeral; digit; number; figure; amount; digital (electronics etc); CL:個|个[ge4]
刷牙,shua1 ya2,to brush teeth
摔,shuai1,to throw down; to fall; to drop and break
甩,shuai3,to throw; to fling; to swing; to leave behind; to throw off
帅,shuai4,handsome; graceful; smart; commander in chief
双,shuang1,two; double; pair; both
双方,shuang1 fang1,bilateral; both sides; both parties involved
水,shui3,water; river; liquid; beverage; additional charges or income; (of clothes) classifier for number of washes
水果,shui3 guo3,fruit; CL:個|个[ge4]
水平,shui3 ping2,level (of achievement etc); standard; horizontal
税,shui4,taxes; duties
睡觉,shui4 jiao4,to go to bed; to go to sleep
顺便,shun4 bian4,conveniently; in passing; without much extra effort
顺利,shun4 li4,smoothly; without a hitch
顺序,shun4 xu4,sequence; order
说不定,shuo1 bu5 ding4,can't say for sure; maybe
说服,shuo1 fu2,to persuade; to convince; to talk sb over; Taiwan pr. shui4 fu2
说话,shuo1 hua4,to speak; to say; to talk; to gossip; to tell stories; talk; word
说明,shuo1 ming2,to explain; to illustrate; explanation; directions; caption; CL:個|个[ge4]
硕士,shuo4 shi4,master's degree; learned person
撕,si1,to tear
丝绸,si1 chou2,silk cloth; silk
丝毫,si1 hao2,the slightest amount or degree; a bit
司机,si1 ji1,chauffeur; driver; CL:個|个[ge4]
思考,si1 kao3,to reflect on; to ponder over
思想,si1 xiang3,thought; thinking; idea; ideology; CL:個|个[ge4]
私人,si1 ren2,private (citizen); private
死,si3,to die; impassable; uncrossable; inflexible; rigid; extremely
四,si4,four; 4
似乎,si4 hu1,apparently; to seem; to appear; as if; seemingly
寺庙,si4 miao4,temple; monastery; shrine
送,song4,to deliver; to carry; to give (as a present); to present (with); to see off; to send
速度,su4 du4,speed; rate; velocity; CL:個|个[ge4]
塑料袋,su4 liao4 dai4,plastic bag
宿舍,su4 she4,dormitory; dorm room; living quarters; hostel; CL:間|间[jian1]
酸,suan1,sour; sore; ache; acid
算,suan4,regard as; to figure; to calculate; to compute
虽然,sui1 ran2,although; even though; even if
随便,sui2 bian4,as one wishes; as one pleases; at random; negligent; casual; wanton
随时,sui2 shi2,at any time
随着,sui2 zhe5,along with; in the wake of; following
岁,sui4,classifier for years (of age); year; year (of crop harvests)
碎,sui4,to break down; to break into pieces; fragmentary
孙子,sun1 zi5,grandson
损失,sun3 shi1,loss; damage; CL:個|个[ge4]; to lose; to damage
缩短,suo1 duan3,to curtail; to cut down
缩小,suo1 xiao3,reduce; decrease
锁,suo3,to lock up; to lock; CL:把[ba3]
所,suo3,"actually; place; classifier for houses, small buildings, institutions etc; that which; particle introducing a relative clause or passive; CL:個|个[ge4]"
所谓,suo3 wei4,so-called; what is called
所以,suo3 yi3,therefore; as a result; so
所有,suo3 you3,all; to have; to possess; to own
他,ta1,he or him; (used for either sex when the sex is unknown or unimportant); (used before sb's name for emphasis); (used as a meaningless mock object); other; another
她,ta1,she
它,ta1,it
塔,ta3,pagoda; tower; minaret; stupa (abbr. loanword from Sanskrit tapo); CL:座[zuo4]
台,tai2,desk; platform; stage; terrace; stand; support; desk; station; broadcasting station; classifier for vehicles or machines; Taiwan (abbr.)
抬,tai2,to lift; to raise; (of two or more persons) to carry
台阶,tai2 jie1,flight of steps (leading up to a house); step (over obstacle); bench; fig. way out of an embarrassing situation
太,tai4,highest; greatest; too (much); very; extremely
太极拳,tai4 ji2 quan2,"shadowboxing or Taiji, T'aichi or T'aichichuan; traditional form of physical exercise or relaxation; a martial art"
太太,tai4 tai5,"married woman; Mrs.; Madam; wife; CL:個|个[ge4],位[wei4]"
太阳,tai4 yang2,sun; CL:個|个[ge4]
态度,tai4 du5,manner; bearing; attitude; approach; CL:個|个[ge4]
谈,tan2 ,to talk
谈判,tan2 pan4,to negotiate; negotiation; talks; conference; CL:個|个[ge4]
弹钢琴,tan2 gang1 qin2,play the piano
坦率,tan3 shuai4,frank (discussion); blunt; open
汤,tang1 ,soup; broth; hot water
糖,tang2,"sugar; sweets; candy; CL:顆|颗[ke1],塊|块[kuai4]"
躺,tang3,to recline; to lie down
烫,tang4,to scald; to burn; to iron; hot
趟,tang4,quantifier for the number of trips or runs made
桃,tao2,peach
逃,tao2,to escape; to run away; to flee
逃避,tao2 bi4,to escape; to evade; to avoid; to shirk
讨论,tao3 lun4,to discuss; to talk over; CL:個|个[ge4]
讨厌,tao3 yan4,disgusting; troublesome; nuisance; nasty; to hate doing sth
套,tao4,"cover; sheath; to encase; a case; to overlap; to interleave; bend (of a river or mountain range, in place names); harness; classifier for sets, collections; tau (Greek letter Ττ)"
特别,te4 bie2,especially; special; particular; unusual
特点,te4 dian3,characteristic (feature); trait; feature; CL:個|个[ge4]
特殊,te4 shu1,special; particular; unusual; extraordinary
特意,te4 yi4,specially; intentionally
特征,te4 zheng1,characteristic; diagnostic property; distinctive feature; trait
疼,teng2,(it) hurts; love fondly; ache; pain; sore
疼爱,teng2 ai4,to love dearly
踢足球,ti1 zu2 qiu2,play soccer(football)
提,ti2,to carry; to lift; to raise
提倡,ti2 chang4,to promote; to advocate
提纲,ti2 gang1,the key point; outline
提高,ti2 gao1,to raise; to increase
提供,ti2 gong1,to offer; to supply; to provide; to furnish
提前,ti2 qian2,to shift to an earlier date; to bring forward; to advance
提问,ti2 wen4,to question; to quiz; to grill
提醒,ti2 xing3,to remind; to call attention to; to warn of
题,ti2,"topic; problem for discussion; exam question; subject; to inscribe; to mention; surname Ti; CL:個|个[ge4],道[dao4]"
题目,ti2 mu4,subject; title; topic; CL:個|个[ge4]
体会,ti3 hui4,know (through learning or by experience); CL:個|个[ge4]
体积,ti3 ji1,volume; bulk; CL:個|个[ge4]
体贴,ti3 tie1,considerate (of other people's needs)
体现,ti3 xian4,to embody; to reflect; to incarnate
体验,ti3 yan4,to experience for oneself
体育,ti3 yu4,sports; physical education
天空,tian1 kong1,sky
天气,tian1 qi4,weather
天真,tian1 zhen1,naive; innocent; artless
甜,tian2,sweet
填空,tian2 kong4,to fill a job vacancy; to fill in a blank (e.g. on questionnaire or exam paper)
田野,tian2 ye3,field; open land; CL:片[pian4]
条,tiao2,"strip; item; article; clause (of law or treaty); classifier for long thin things (ribbon, river, road, trousers etc)"
条件,tiao2 jian4,condition; circumstances; term; factor; requirement; prerequisite; qualification; CL:個|个[ge4]
调皮,tiao2 pi2,naughty; mischievous; unruly
调整,tiao2 zheng3,adjustment; revision; CL:個|个[ge4]
挑战,tiao3 zhan4,challenge
跳舞,tiao4 wu3,to dance
听,ting1,"to listen; to hear; to obey; a can (loanword from English ""tin""); classifier for canned beverages"
停止,ting2 zhi3,to stop; to halt; to cease
挺,ting3,to stick out; to (physically) straighten up; to endure or hold out; straight; stiff; outstanding; extraordinary; rather; quite; very; classifier for machine guns
通常,tong1 chang2,regular; usual; ordinary; normal
通过,tong1 guo4,by means of; through; via; to pass through; to get through; to adopt; to pass (a bill); to switch over
通讯,tong1 xun4,communications; a news story (e.g. dispatched over the wire); CL:個|个[ge4]
通知,tong1 zhi1,to notify; to inform; notice; notification; CL:個|个[ge4]
铜,tong2,copper (chemistry); see also 紅銅|红铜[hong2 tong2]; CL:塊|块[kuai4]
同情,tong2 qing2,compassion; relent; sympathize; sympathy
同时,tong2 shi2,at the same time; simultaneously
同事,tong2 shi4,"colleague; co-worker; CL:個|个[ge4],位[wei4]"
同学,tong2 xue2,"(fellow) classmate; CL:位[wei4],個|个[ge4]"
同意,tong2 yi4,to agree; to consent; to approve
统一,tong3 yi1,to unify; to unite; to integrate
统治,tong3 zhi4,to rule (a country); to govern; rule; regime
痛苦,tong4 ku3,pain; suffering; painful; CL:個|个[ge4]
痛快,tong4 kuai4,overjoyed; delighted; happily; heartily; enjoying; also pr. tong4 kuai5
头发,tou2 fa5,hair (on the head)
投资,tou2 zi1,investment; to invest
透明,tou4 ming2,transparent; open (non-secretive)
突出,tu1 chu1,prominent; outstanding; to give prominence to; to protrude; to project
突然,tu1 ran2,sudden; abrupt; unexpected
图书馆,tu2 shu1 guan3,"library; CL:家[jia1],個|个[ge4]"
土地,tu3 di4,land; territory; soil; local god; Lar; genius loci; CL:片[pian4]
土豆,tu3 dou4,potato; CL:個|个[ge4]
吐,tu4,to vomit; to throw up
兔子,tu4 zi5,hare; rabbit; CL:隻|只[zhi1]
团,tuan2,regiment; round; circular; group; society
推,tui1,to push; to cut; to refuse; to reject; to decline; to shirk (responsibility); to put off; to delay; to push forward; to nominate; to elect
推迟,tui1 chi2,to postpone; to put off; to defer
推辞,tui1 ci2,"to decline (an appointment, invitation etc)"
推广,tui1 guang3,to extend; to spread; to popularize; CL:個|个[ge4]
推荐,tui1 jian4,to recommend; recommendation
腿,tui3,leg; CL:條|条[tiao2]
退,tui4,retreat; to decline; to move back; to withdraw
退步,tui4 bu4,degenerate; regress
退休,tui4 xiu1,retirement (from work)
脱,tuo1,to shed; to take off; to escape; to get away from
袜子,wa4 zi5,"socks; stockings; CL:隻|只[zhi1],對|对[dui4],雙|双[shuang1]"
歪,wai1,askew; at a crooked angle; devious; noxious
外,wai4,outside; in addition; foreign; external
外交,wai4 jiao1,diplomacy; diplomatic; foreign affairs; CL:個|个[ge4]
弯,wan1,bend; bent; CL:道[dao4]
完,wan2,to finish; to be over; whole; complete; entire
完成,wan2 cheng2,complete; accomplish; perfect tense (grammar)
完美,wan2 mei3,perfect; perfection; perfectly
完全,wan2 quan2,complete; whole; totally; entirely
完善,wan2 shan4,perfect; to make perfect; to improve
完整,wan2 zheng3,complete; intact
玩,wan2,toy; sth used for amusement; curio or antique (Taiwan pr. wan4); to play; to have fun; to trifle with; to keep sth for entertainment
玩具,wan2 ju4,plaything; toy
碗,wan3,"bowl; cup; CL:隻|只[zhi1],個|个[ge4]"
晚上,wan3 shang5,in the evening; CL:個|个[ge4]
万,wan4,ten thousand; a great number
万一,wan4 yi1,just in case; if by any chance; contingency
王子,wang2 zi3,prince; son of a king
往,wang3,to go (in a direction); to; towards; (of a train) bound for; past; previous
往返,wang3 fan3,to go back and forth; to go to and fro
往往,wang3 wang3,often; frequently
网球,wang3 qiu2,tennis; CL:個|个[ge4]
网站,wang3 zhan4,website; network station; node
忘记,wang4 ji4,to forget
危害,wei1 hai4,to jeopardize; to harm; to endanger; CL:個|个[ge4]
危险,wei1 xian3,danger; dangerous
微笑,wei1 xiao4,smile; CL:個|个[ge4]
威胁,wei1 xie2,to threaten; to menace
违反,wei2 fan3,to violate (a law)
维护,wei2 hu4,to defend; to safeguard; to protect; to uphold; to maintain
围巾,wei2 jin1,scarf; shawl; CL:條|条[tiao2]
围绕,wei2 rao4,to revolve around; to center on (an issue)
唯一,wei2 yi1,only; sole
尾巴,wei3 ba5,tail
伟大,wei3 da4,great; mighty; large
委屈,wei3 qu1,to feel wronged; to nurse a grievance; to cause sb to feel wronged
委托,wei3 tuo1,to entrust; to trust; to commission
喂,wei4,"hello (interj., esp. on telephone); hey; to feed (sb or some animal)"
胃,wei4,stomach; CL:個|个[ge4]
为,wei4,because of; for; to
为了,wei4 le5,in order to; for the purpose of; so as to
为什么,wei4 shen2 me5,why?; for what reason?
位,wei4,position; location; place; seat; classifier for people (honorific); classifier for binary bits (e.g. 十六位 16-bit or 2 bytes)
位置,wei4 zhi5,position; place; seat; CL:個|个[ge4]
未必,wei4 bi4,not necessarily; maybe not
未来,wei4 lai2,future; tomorrow; approaching; coming; pending; CL:個|个[ge4]
味道,wei4 dao4,flavor; smell; hint of
卫生间,wei4 sheng1 jian1,bathroom; toilet; WC; CL:間|间[jian1]
温度,wen1 du4,temperature; CL:個|个[ge4]
温暖,wen1 nuan3,warm
温柔,wen1 rou2,gentle and soft; tender
闻,wen2,to hear; news; well-known; famous; reputation; fame; to smell; to sniff at; surname Wen
文化,wen2 hua4,"culture; civilization; cultural; CL:個|个[ge4],種|种[zhong3]"
文件,wen2 jian4,document; file; CL:份[fen4]
文具,wen2 ju4,"stationery; item of stationery (pen, pencil, eraser, pencil sharpener etc)"
文明,wen2 ming2,civilized; civilization; culture; CL:個|个[ge4]
文学,wen2 xue2,literature; CL:種|种[zhong3]
文章,wen2 zhang1,"article; essay; literary works; writings; hidden meaning; CL:篇[pian1],段[duan4],頁|页[ye4]"
吻,wen3,kiss; mouth
稳定,wen3 ding4,steady; stable; stability; to stabilize; to pacify
问,wen4,to ask
问候,wen4 hou4,to give one's respects; to send a greeting
问题,wen4 ti2,question; problem; issue; topic; CL:個|个[ge4]
我,wo3,I; me; my
我们,wo3 men5,we; us; ourselves; our
卧室,wo4 shi4,bedroom; CL:間|间[jian1]
握手,wo4 shou3,to shake hands
污染,wu1 ran3,pollution; contamination; CL:個|个[ge4]
屋子,wu1 zi5,house; room; CL:間|间[jian1]
无,wu2,-less; not to have; no; none; not; to lack; un-
无聊,wu2 liao2,nonsense; bored
无论,wu2 lun4,no matter what or how; regardless of whether...
无奈,wu2 nai4,without choice; for lack of better option; grudgingly; willy-nilly; nolens volens; abbr. for 無可奈何|无可奈何[wu2 ke3 nai4 he2]
无数,wu2 shu4,countless; numberless; innumerable
五,wu3,five; 5
武器,wu3 qi4,weapon; arms; CL:種|种[zhong3]
武术,wu3 shu4,military skill or technique (in former times); all kinds of martial art sports (some claiming spiritual development); self-defense; tradition of choreographed fights from opera and film (recent usage); also called kungfu 功夫; CL:種|种[zhong3]
雾,wu4,"fog; mist; CL:場|场[chang2],陣|阵[zhen4]"
误会,wu4 hui4,to misunderstand; to mistake; misunderstanding; CL:個|个[ge4]
物理,wu4 li3,physics; physical
物质,wu4 zhi4,matter; substance; material; materialistic; CL:個|个[ge4]
西,xi1,west
西瓜,xi1 gua1,watermelon; CL:條|条[tiao2]
西红柿,xi1 hong2 shi4,tomato; CL:隻|只[zhi1]
吸收,xi1 shou1,to absorb; to assimilate; to ingest
吸引,xi1 yin3,"to attract (interest, investment etc); CL:個|个[ge4]"
希望,xi1 wang4,to wish for; to desire; hope CL:個|个[ge4]
习惯,xi2 guan4,habit; custom; usual practice; to be used to; CL:個|个[ge4]
洗,xi3,to wash; to bathe
洗手间,xi3 shou3 jian1,toilet; lavatory; washroom
洗衣机,xi3 yi1 ji1,washer; washing machine; CL:臺|台[tai2]
洗澡,xi3 zao3,to bathe; to take a shower
喜欢,xi3 huan5,to like; to be fond of
系,xi4,to connect; to relate to; to tie up; to bind; to be (literary)
系统,xi4 tong3,system; CL:個|个[ge4]
细节,xi4 jie2,details; particulars
戏剧,xi4 ju4,drama; play; theater
瞎,xia1,blind; groundlessly; foolishly; to no purpose
吓,xia4,to frighten; to scare; to intimidate; to threaten
夏,xia4,summer
下,xia4,down; downwards; below; lower; later; next (week etc); second (of two parts); to decline; to go down
下午,xia4 wu3,afternoon; p.m.; CL:個|个[ge4]
下雨,xia4 yu3,to rain; rainy
下载,xia4 zai3,to download; also pr. xia4 zai4
先,xian1,early; prior; former; in advance; first
先生,xian1 sheng5,"teacher; Mister (Mr.); husband; doctor (topolect); CL:個|个[ge4],位[wei4]"
鲜艳,xian1 yan4,bright-colored; gaily-colored
咸,xian2,salted; salty; stingy; miserly
显得,xian3 de5,to seem; to look; to appear
显然,xian3 ran2,clear; evident; obvious(ly)
显示,xian3 shi4,to show; to illustrate; to display; to demonstrate
县,xian4,"county, PRC administrative division below prefecture 地區|地区[di4 qu4]; CL:個|个[ge4]"
现代,xian4 dai4,modern times; modern age; modern era
现金,xian4 jin1,cash
现实,xian4 shi2,reality; actuality; real; actual; CL:個|个[ge4]
现象,xian4 xiang4,appearance; phenomenon; CL:個|个[ge4]
现在,xian4 zai4,now; at present; at the moment; modern; current; nowadays
羡慕,xian4 mu4,envious; envy; to admire
限制,xian4 zhi4,to restrict; to limit; to confine; restriction; limit; CL:個|个[ge4]
香,xiang1,fragrant; sweet smelling; aromatic; savory or appetizing; (to eat) with relish; (of sleep) sound; perfume or spice; joss or incense stick; CL:根[gen1]
香蕉,xiang1 jiao1,"banana; CL:枝[zhi1],根[gen1],個|个[ge4],把[ba3]"
相处,xiang1 chu3,get along with each other
相当,xiang1 dang1,equivalent to; appropriate; considerably; to a certain extent; fairly
相对,xiang1 dui4,relatively; opposite; to resist; to oppose; relative; vis-a-vis
相反,xiang1 fan3,opposite; contrary
相关,xiang1 guan1,interrelated; correlation; dependence; relevance; mutuality
相似,xiang1 si4,to resemble; similar; like; resemblance; similarity
相同,xiang1 tong2,identical; same
相信,xiang1 xin4,be convinced (that something is true); believe; to accept sth as true
详细,xiang2 xi4,detailed; in detail; minute
响,xiang3,to make a sound; to sound; to ring; loud; classifier for noises
想,xiang3,to think; to believe; to suppose; to wish; to want; to miss
想念,xiang3 nian4,miss; remember with longing; long to see again
想象,xiang3 xiang4,to imagine; to fancy; CL:個|个[ge4]
享受,xiang3 shou4,to enjoy; to live it up; pleasure; CL:種|种[zhong3]
向,xiang4,direction; orientation; to face; to turn toward; to; towards; shortly before; formerly; to side with; to be partial to; all along (previously); surname Xiang
像,xiang4,(look) like; similar (to); appearance; to appear; to seem; image; portrait; resemble; seem
项,xiang4 ,neck; sum; funds
项链,xiang4 lian4,necklace
项目,xiang4 mu4,item; project; sports event; CL:個|个[ge4]
橡皮,xiang4 pi2,rubber; an eraser; CL:塊|块[kuai4]
象棋,xiang4 qi2,Chinese chess; CL:副[fu4]
象征,xiang4 zheng1,emblem; symbol; token; badge; to symbolize; to signify; to stand for
消费,xiao1 fei4,to consume; CL:個|个[ge4]
消化,xiao1 hua4,digest; digestion; digestive
消灭,xiao1 mie4,to put an end to; to annihilate; to cause to perish; to perish; annihilation (in quantum field theory)
消失,xiao1 shi1,to disappear; to fade away
销售,xiao1 shou4,to sell; market; sales
消息,xiao1 xi5,news; information; CL:條|条[tiao2]
小,xiao3,small; tiny; few; young
小吃,xiao3 chi1,snack; refreshments; CL:家[jia1]
小伙子,xiao3 huo3 zi5,lad; young fellow; youngster; CL:個|个[ge4]
小姐,xiao3 jie5,"young lady; miss; CL:個|个[ge4],位[wei4]"
小麦,xiao3 mai4,wheat; CL:粒[li4]
小气,xiao3 qi4,stingy; petty; miserly; narrow-minded
小时,xiao3 shi2,hour; CL:個|个[ge4]
小说,xiao3 shuo1,"novel; fiction; CL:本[ben3],部[bu4]"
小偷,xiao3 tou1,thief
小心,xiao3 xin1,to be careful; to take care
笑,xiao4,laugh; smile; CL:個|个[ge4]
笑话,xiao4 hua4,joke; jest; CL:個|个[ge4]
效果,xiao4 guo3,result; effect; quality; CL:個|个[ge4]
效率,xiao4 lv4,efficiency
孝顺,xiao4 shun4,filial piety; to be obedient to one's parents
校长,xiao4 zhang3,"(college, university) president; headmaster; CL:個|个[ge4],位[wei4],名[ming2]"
些,xie1,some; few; several; (a measure word)
歇,xie1,to rest
斜,xie2,inclined; slanting; oblique; tilting
鞋,xie2,"shoe; CL:雙|双[shuang1],隻|只[zhi1]"
协调,xie2 tiao2,to coordinate; to harmonize; negotiation
写,xie3,to write
谢谢,xie4 xie5,to thank; thanks
新,xin1,new; newly; meso- (chemistry)
